name,review,star,review_num,ave_star,label
낙랑파라,일단 분위기 인테리어 좋음당근케익맛있음,4.0,39,3.4,0
낙랑파라,알바생들이 조금 불친절하고 아메리카노가 너무 맛이 없어요,2.0,9,4.1,1
낙랑파라,공간도 넓고 의자도 편해서 조용하게 커피 마시기 좋은 곳 홍대입구역의 많은 카페들이 가진 느낌인 복잡한 거 싫어하는 분들에게 추천 단 음료가 담긴 잔이 너무 작아서 음료는 비싸다고 생각함 재 방문 의사 있음,4.0,28,4.0,0
낙랑파라,커피 너무 잘마셨어요넘넘 맛있어요그리고 무엇보다 친절하게 설명해주셔서 넘 좋았어요다음에 친구들이랑 방문해야겠어요,5.0,3,5.0,0
낙랑파라,카페는 넘 좋은데 직원분이 넘 불친절 저만 그렇게 느낀게 아닌거같네요ㅠ,1.0,136,4.2,1
낙랑파라,초코 하나도 안 진하고일하시는 분 핵 불친절 ㅎㅎ ,1.0,2,3.0,1
낙랑파라,평범해요,3.0,126,4.7,1
낙랑파라,직원이 좀 불친절하고 음료가 향이 너무 없어서 맛이 좀 그렇네요 근데 가격은 ㅎㅎ,1.0,21,4.2,1
낙랑파라,불친절 기분 딱 나쁨,1.0,1,1.0,1
낙랑파라,지하 자리에 절대 앉지 마세요하수구 오물 냄새가 계속 나서 고통스러웠어요음료는 괜찮습니다,2.0,7,4.3,1
낙랑파라,아포가토 먹는데 견과류가 오래된것 같아요안좋은 재료쓸거면 그냥 빼주시는게 나을것같아요,1.0,19,3.3,1
낙랑파라,레몬티 먹다가 혀 마비옴,2.0,2,1.5,1
낙랑파라,주택을 개조한 카페 층에 실제로 거주인이 살고있어서 이곳의 마스코트인 대형견과 산책을 마치고 올라가심일단 인테리어와 작은 소품들로 엄청 잘 꾸며져 있고 한쪽에는 책들도 많이 있어서 심심할때 하나씩 꺼내보는 재미도 있고 층에서는 엔틱한 소품들을 판매해서 구경하는 재미도 쏠쏠에어컨 빵빵하고 사실 좀 추워서 담요가 필요할 정돜ㅋㅋ좌석이 넉넉하고 넓직하고 쾌적해서 너무 좋았어요,4.0,247,3.5,0
낙랑파라,자리 많아서 좋음 사람 없을때가니까 매우한적,5.0,146,4.5,0
낙랑파라,인간적으로와이파이속도너무느리네요 다른건괜찮았어요,1.0,62,2.6,1
낙랑파라,망고빙수 증말 맛있어요,4.0,51,3.7,0
낙랑파라,밀크티는 데자와 부어놓은 듯한 성의 없는 맛넛츠 요거트는 견과류와 요거트의 비율이 바뀐 거 같아요너무 퍽퍽함오렌지 자몽은 신맛만 너무 강해요얼그레이롤도 그냥 쏘쏘옛날에 왔다가 오랜만에 온건데 실망했어요ㅠ,1.0,31,3.5,1
낙랑파라,커피맛이 대중적이어서 누굴 데려가야하거나 만나야할때 좋음음료에 신경많이 쓴게 보임갈때마다 사람이 많던 적던 메뉴에 기복이 없고나오는 속도 겁나 빠름 서비스는 댓글보고 걱정했는데 괜찮았고 오히려 바쁜데도 응대 좋았음,5.0,7,4.4,0
낙랑파라,아이스 아메리카노 먹고 질겁가게 문구 타이포나 전반적으로 애매합니다,2.0,38,3.5,1
낙랑파라,분위기좋음음료는 보통,2.0,220,3.0,1
낙랑파라,직원들이 웃는 모습은 볼 수 없지만 여기 까페 분위기가 편해서 종종 감 레몬에이드 추천 양도 많고 인위적 시럽맛이 나지 않아 좋음,4.0,49,3.3,0
낙랑파라,좋았습니다 좋았습니다,5.0,258,4.1,0
낙랑파라,골목 안에 숨겨져 있는 빈티지 예쁜 카페 안쪽에 숨겨져 있는데도 많이 찾아온다 예쁘고 조용한 카페골목의 오아시스 딱 맞는 표현,4.0,110,3.9,0
델문도,맛도 응대도 뭔가 묘하지만 분위기 깡패,4.0,29,4.7,0
델문도,분위기는 좋지만 상당히 불친절함,2.0,91,3.6,1
델문도,분위기는 좋지만 맛있는지도 잘 모르겠어요직원분들이 다 기본적으로 불친절한 느낌이십니다,2.0,25,3.9,1
델문도,매 시즌 새로운 메뉴를 선보이는 것은 대단하다고 생각합니다 그러나 가격 대비 또 찾을 맛은 아니었어요 또한 종업원 분이 기분 나쁜 일을 겪으신 것 같았어요,1.0,1,1.0,1
델문도,화장실이 정말 더러움 남녀 혼용이고카페도 더러움 무너져사는 느낌매니아들은 좋아하는 것 같더라고요,2.0,9,3.6,1
델문도,제가 어지간해선 이런 후기 안남기는데요 이런부분은 조금 고치셨음 해서 적어봅니다친구 데리고 여기 가보고싶다고해서 가서 열심히 고르고 수박카키고오리 맛있겠다며 친구가 얘기하러갔을때 저도 들었습니다 카키고오리 안된다고요안쪽에 계신 분이 크게 안된다고 얘기하셨죠 근데 뻔히 옆테이블 먹고있는거 보고 아 저게끝이었나 근데오픈한지 분도안되었는데하구 음료가져다주신 다른직원분에게 물어보니까 블루카키고오리는 안되고 수박은된다고요 카키고오리가 안된다면서요   친구도 그렇고 저도그렇고 기분이 좋지 않았습니다 저도 같은 종사자인데요 바쁘다면 그런상황 이해합니다 근데 그때 매장안에는 모녀 분  남자 한분  여자 한분  그리고 저희가 들어오고 다른팀이 오셨죠 저희가 들어왔을때 이미 양옆테이블쪽 주문끝나고 메뉴가 나오고있는데 그렇게 안된다고만 얘기하시면 고객의 입장으로선 기분이 나쁠수밖에 없습니다 저희가 뒤에 물어봤을때 대답했던 직원분이 얘기한것처럼 블루시럽이 없어서 그런거라고 얘기했으면 저희의 대화도 이렇게 엇나가진 않았겠죠 저야 여기안오면 그만이지만 다른분들께는 조금만 더  신경써주셨으면 해요,1.0,1,1.0,1
델문도,영업시간 바뀜오야코돈 일본 여관풍 아침식사 아메리카노 우롱밀크 푸딩인기는 많은데 비해서 두번은 안올 것 같음커피 잔에는 김 붙어서 나오고일본 여관풍 아침 식사에 연어는 기성품 쓰는지 비린내가 심하고 이 메뉴에 ㅋㅋㅋ 미니 디저트인지 코코볼 나오는거 보고 기겁함오야코돈은 먹다가 역한 냄새가 계속 올라옴,1.0,8,4.1,1
델문도,엄청난 일본 바이브를 풍기는 곳 맛도 괜찮고 일본풍 디저트가 먹고 싶다면 추천드립니다 아지트 느낌에 아기자기한 소품들도 귀엽습니다 ,4.0,20,4.5,0
델문도,인스타 감성카페 자주 다닌분들은 진짜 만족할듯다른카페에서 자주볼수없는 일본식 디저트가 존맛ㅜ사장님도 친절하심 ,5.0,40,3.8,0
델문도,진짜 너무 너무 더러워요친구가 들어가기 전에 대충 얘기는 해줘서 마음먹고 들어갔는데도 진짜 오바에요일본의 맛을 즐기고 싶으신 분들이라면 다른 곳에서 즐기셔도 충분하다고 생각합니다너무 더러워서 다시 나오려다가 궁금했던 곳이기에 꾹 참고 앉아있다 나왔는데 그냥 다른 곳 가셔도 될 것 같아요,1.0,4,1.3,1
델문도,어둡고 지저분하고 여기서 음식을 팔아도 되나 궁금함왜 유명한지 모르겠음 친구따라 한번 와봤는데 절대 또 오고싶지 않음,2.0,37,3.7,1
델문도,일본 여고생이 된 듯한 느낌을 받을때가 많아요ㅋㅋㅋ홍차 젤리류의 디저트가 먹고싶을때 자주 갑니다 찾기 힘들어도 디저트 맛집,4.0,28,4.0,0
델문도,완벽하진 않지만 마음이 편해지는 곳 오년넘게 자주 찾아가는 아지트에요,4.0,83,4.0,0
델문도,식사는 별세개 디저트는 별네개,4.0,749,3.3,0
델문도,위생이 너무안좋아보이고 상은 년전 국밥집에서 쓰던 밥상들고온거같았음다신안갈듯,2.0,28,1.6,1
델문도,카페 테라스 앞 풍경 너무너무 이쁘구요 커피도 맛있어요 맛도 맛있어요,4.0,429,3.7,0
델문도,말이 필요 없다    깔끔하고 좋아요,5.0,20,4.9,0
델문도,음식 디저트 차 맛도 좋고 분위기도 친구네 작업실 온 것 같아 편합니다,5.0,17,4.5,0
델문도,메뉴 자주 바껴서 시즌메뉴 찾아 먹는 것도 좋고 조용하고 오래 남아줘서 고마운 곳중학생때 처음 갔는데 아직도 그대로점심 메뉴도 맛있으니 카레 드세요,4.0,88,3.8,0
델문도,크림브륄레 카라멜푸딩 정말 맛있어요,5.0,123,4.0,0
델문도,분위기,5.0,5,3.8,0
델문도,애정하는 델문도 일본 가정식 한상을 시키면 구수한 낫토와 연어구이 쫀득한 고봉밥에 우메보시와 김과 된장국이 나온다 생초콜릿과 호지차는 덤 많지 않아 보이지만 먹다보면 배불러서 조금 남길 정도 그냥 분위기가 아늑하고 조명이 좋고 무엇보다 홍대의 붐빔이 느껴지지 않아 좋다 매장 뮤직 플레이리스트가 간혹가다 좀 거슬리긴 하지만 뭐 이정도면 아주 준수함,4.0,202,2.9,0
밀로커피로스터스,     ,4.0,"8,535",3.3,0
밀로커피로스터스,오랫동안 너무 애정하는 곳인데 요즘 아쉬움 사장님 부부는 정중하시고 담백하신데 젊은 남자분 태도에 문제 많아 보임 손님들한테 거만하고 틱틱대는 거 많이 봄 코로나 첫해 여름에 창문 조금 열어놨는데 에어컨 틀었으니 닫으라고 함 코로나라 열어야 되는 거 아니냐고 하니 그냥 닫으라며 앞에 버티고 서 있어서 몽블랑 오분만에 마시고 나옴 최근에는 사장님 안 계실때 자주 지인들과 테이블에 앉아서 수다 떨던데 보기 싫음ㅋㅋ 자기 일 잘하고 그러면 상관없지만 그마저도 밀로 분위기는 아님 손님들 기분 나쁘게 해놓고 자기만 즐거움 아들인지 직원인지 사장님도 안하시는 잘만 척을 왜 자기가 하는지 모르겠음 노구에 직접 사다리에 올라가셔서 주기적으로 찻잔 바꾸시는 등 늘 기본에 충실하신 모습에 잔잔한 감동 받는 곳이었는데 점점 안가게 됨 ㅠ,4.0,58,3.6,0
밀로커피로스터스,와 이렇게 후기가 극과 극으로 갈릴 수도 있구나 저는 오트유로 해서 비건 바닐라 라떼 마셨는데 맛나더라구요 사장님도 무척 젠틀하셨음다 식물성 우유 있는 것부터 따봉임,5.0,13,5.0,0
밀로커피로스터스,비엔나커피 마셨는데 감기약 먹는줄 알았어요 방문 당시에 마스크 안끼고 계셨음,1.0,61,4.2,1
밀로커피로스터스,매우 불친절,1.0,16,2.3,1
밀로커피로스터스,밀크티 원에 양 무슨일이죠맛도 평범,2.0,16,3.1,1
밀로커피로스터스,이것이 커피,5.0,203,2.9,0
밀로커피로스터스,커피는 어느곳보다 훌륭합니다,5.0,3,5.0,0
밀로커피로스터스,아 여러번 방문 결과 그냥 ㅋㅋㅋ 싸가지,1.0,50,2.3,1
밀로커피로스터스,뭐 물어보면 아저씨 죄다 반말로 대답함 커피한잔 시켰는데 분 기다림 오래 기다리는데 직원 명 중 두명이 생크림만 계속 만듬 나보다 늦게 온 테이크아웃 손님 먼저 줌 커피 받았는데 거의 레몬즙임 다시는 가고싶지 않다,1.0,4,1.0,1
밀로커피로스터스,비엔나 커피 여기가 제일 괜찮았던거 같아요 물론 가격이 너무 비싸긴 해서 가성비가 좋은 편은 아니지만 크림의 비율과 그에 따른 점도의 크림 이 크림과 잘 맞는 커피를 뽑는 것 어느것 하나 쉬운일 아닌대 여기 맛있었어요 개인적으로 아이스몽블랑이 더 맛있었던거 같아요,4.0,33,2.9,0
밀로커피로스터스,정말 특별한 맛의 몽블랑,5.0,133,4.2,0
밀로커피로스터스,몽블랑 천국의 맛아끼는 이들의 기분 좋은 표정보고 싶을 때 데려올래요,5.0,127,4.5,0
밀로커피로스터스,갓,5.0,136,5.0,0
밀로커피로스터스,자리 안내를 잘 해주시더라구요몽블랑 신맛 강하다는 리뷰보고 시켰는데신맛 조아하는 저는 그렇게 느끼진 못했어요그냥 아주 달달담에 방문하면 다른 거 먹어보려구요,4.0,480,3.5,0
밀로커피로스터스,다들 몽블랑 마시지만 저는 콘파나를 추천 늘 좋아요,5.0,117,4.7,0
밀로커피로스터스,아이스초코 너무 맛있어요 네스퀵맛 아님 담에는 커피도 먹어보고싶어요,5.0,11,4.7,0
밀로커피로스터스,몽블랑 커피 세대로써의 품격을 보여주시는 사장님 맛있게 먹었습니다 건강하고 번창하세요,5.0,112,3.6,0
밀로커피로스터스,훌륭하다,5.0,115,3.8,0
밀로커피로스터스,필터커피 굿,5.0,57,4.4,0
밀로커피로스터스,몽블랑 존맛탱,5.0,31,4.3,0
밀로커피로스터스,여기 아이리쉬 커피 아주 맛있다,5.0,116,4.5,0
밀로커피로스터스,전반적으로 준수하지만 크게 두드러지는 메뉴가 없음,4.0,64,3.8,0
밀로커피로스터스,낮 시경 방문 사장님 점잖으시면서 자상하신 신사분 몽블랑 커피는 신맛과 단맛의 적절한 조화로 마시는 내내 좋은 초이스였다 스스로를 칭찬함 가격은 홍대한 가격 다음엔 녹차라떼로를 시도해볼 예정,5.0,17,4.3,0
밀로커피로스터스,따뜻한 몽블랑 마셨습니다한입 들이키는순간 요리왕비룡에서 배경 바뀌는것마냥 영국 귀족된줄알았고행복해서 터져나오는 웃음을 어쩌지못해 황급히 마스크를 올렸습니다산미가 강한 편인데 전 원래 산미를 좋아해서 호불호가 있을 수 있는 맛이지만 어쨌든 영국 귀족에 빙의하고 왔습니다 ㅋ 음악도 완전 ,5.0,202,4.2,0
밀로커피로스터스,최근 홍대에서 마신 커피중 젤 맛나요콜롬비아 베이스 플화 마셨는데 부드럽게 살짝 산미있으면서 은은한 고소함로스터스라고 해도 실력 천차만별인데 여긴 잘하는곳이에요 자주 올것같습니다 ㅎ,5.0,10,4.4,0
밀로커피로스터스,년째 최애 카페 나만 알고 싶은 곳인데 요즘 유명해져서 속상함 ㅜ 몽블랑 최고에요,5.0,44,4.0,0
밀로커피로스터스,그래서 사장님은 언제 오시죠,5.0,119,4.4,0
밀로커피로스터스,산미가 강해요,4.0,28,4.4,0
밀로커피로스터스,밀로 블랜드 티는 진짜 미쳤다,5.0,55,4.7,0
밀로커피로스터스,이곳의 몽블랑을 좋아한다 주문하자마자 쳐서 올려주는 차갑고 달콤한 크림이 신맛나는 커피와 정말 잘 어울린다 무엇보다 아이스 플랫화이트를 주문하니 마시기 좋은 온도로 칠링해서 내주니 사랑하지 않을 수 없지,5.0,277,3.8,0
밀로커피로스터스,분위기는 좋지만 커피는 영ㅠㅠ,2.0,129,3.2,1
밀로커피로스터스,겨울뿐만 아니라 겨울이 아닌 계절에 겨울을 느끼고 싶을 때 가서 몽블랑 마셔주면 됩니다 모르겠어요 가끔 왜 이렇게 이런 포근한 맛이 당기는지 늘 기대에 충족하는 커피맛,4.0,19,4.3,0
밀로커피로스터스,커피와 음료 최고,5.0,101,3.4,0
밀로커피로스터스,                                           ,1.0,3,3.7,1
밀로커피로스터스,와 별점의 이유를 알겠네요커피가 맛있어요비오는 날 따뜻한 몽블랑 마셨는데 최고예요ㅜ비싸긴 해요,5.0,363,4.0,0
밀로커피로스터스,커피 괜찮아요분위기 좋아요 방문했을 때 빵은 한가지였어요,4.0,9,4.0,0
밀로커피로스터스,몽블랑 여기가 갑이네요 딴데 안가셔도 될듯,5.0,37,3.7,0
밀로커피로스터스,커피맛은 좋은데 테이블 간격이 너무 좁아요 ㅠ 옆테이블 대화 다 들어야해서 별한개 뺐어요 ㅠㅠ,4.0,153,4.5,0
밀로커피로스터스,조용한 분위기라 좋아요 핸드드립이 예술입니다 몽블랑  적당한 당도의 크림과 산미 강한 원두의 아름다운 조화ㅜㅜ,5.0,1,5.0,0
밀로커피로스터스,따듯한 몽블랑 추천받아서 마셔봤는데 정말 맛있어요 다음엔 핸드드립 마시러 다시 오려구요 기대됩니다,5.0,11,3.9,0
밀로커피로스터스,아 제주도에서  커피  마시려 왔드만  문닫았네일 인데왜  문닫았지,4.0,19,2.0,0
밀로커피로스터스,모든 메뉴가 특히 핸드드립분명히 돈 내고 사먹는다내 돈 내고 먹는데 보상 받는 기분이 드는 곳,5.0,298,2.8,0
밀로커피로스터스,                   ,5.0,20,4.9,0
밀로커피로스터스,진짜 최고에요ㅠㅠ에티오피아 홀빈 에 원이에요 넘 마싯,5.0,61,4.4,0
밀로커피로스터스,와 여기 커피 정말 맛있네요 싱글 오리진 마심주인 어르신과 직원 한 분이 커피 한잔도 정성스레 만들어주는 느낌이네요 ,5.0,4,5.0,0
밀로커피로스터스,맛있는 커피는 많지만 여길 가는 이유는 한결같은 정성스러움과 아늑한 분위기때문이 아닌가 싶습니다 처음 가본게 년이 훌쩍 넘었는데 홍대 인근을 가면 늘 밀로커피에 가고 싶어요 친절하시고 말수 적으신 주인장 아저씨 보고싶습니다,4.0,34,3.2,0
밀로커피로스터스,정성스럽게 준비해주시는 한잔이 편안하고 따뜻한 곳,5.0,16,4.1,0
밀로커피로스터스,이곳의 시그니처는 몽블랑커피예요 아인슈페너 생각하시면 될거같은데 크림이 진짜 맛있더라고요 디스플레이 되어있는 커피잔들이 예쁜게 너무 많아서 구경하는 재미도 있어요 다만 공간이 좀 협소해서 자리가 없을 수 있으니 확인해보고 가세요 다 좋았지만 커피 양이 가격대비 조금 적어서 ㅎㅎ 많이 많이 주셨으면 하는 바람으로 별을 개 줍니당,4.0,"1,553",3.8,0
밀로커피로스터스,커피맛좋아용 몽블랑 먹었는데 원이라 가격은 좀 쎈편이에요,4.0,415,2.9,0
밀로커피로스터스,   ,5.0,15,4.3,0
밀로커피로스터스,가야는이유  아인슈페너 몽블랑 하겐다즈 쓰는 아포가토안가는이유  빨리 먹어야 맛을 즐길 수 있는,4.0,"3,516",3.3,0
밀로커피로스터스,아메리카노에서 이만한 풍미를 느껴본 게 얼마만인지 모르겠다 주변 커피값까지 생각하면 가성비도 훌륭,5.0,21,4.6,0
밀로커피로스터스,몽블랑 커피 아이스 맛있다 쓰지도 않고 달달하지만 지나치게 달지도 않고 정말 맛있다고 느낌,4.0,"1,239",3.6,0
밀로커피로스터스,좋아요우,4.0,250,3.4,0
더귀여워,아기들 최고ㅠㅠ,5.0,68,4.6,0
더귀여워,평점보고 살짝 가도될려나 고민했는데간식들도 싸게파시고 친절하셔서지금까지 가본 애견카페중 제일 좋았던거같습니다,5.0,2,3.0,0
더귀여워,너무 귀엽고 관리도 잘 되어있는 것 같아요 무엇보다 주인분이 친절하셔서 또 가고 싶네요,5.0,5,3.8,0
더귀여워,공간 크기에 비해 강아지 수가 너무 많아보여요환기도 잘 안 되는 것 같고 바닥도 미끄러운 재질이고,2.0,12,4.4,1
더귀여워,친구들이랑 재밌게 놀다갔어요강아지보다 카페사장님한테 더 정이 붙어서 나중엔 친구들 없이 혼자라도 놀러올 생각입니다 ㅋㅋ,5.0,3,2.3,0
더귀여워,친구랑 홍대 놀러갔다가 있길래 갔는데 고양이방에 고양이 딱 한마리 있었고 직원 불친절하구요 직원 몇몇분은 강아지들한테 관심있는데 몇분은 관심 없으시더라구요그리고 냄새나요제가 가본 애견 카페 중 최악이었습니다다신 안가려구요,1.0,11,3.3,1
더귀여워,관리도 너무 잘 되어있구 강아지들도 예뻤어요,5.0,6,3.0,0
더귀여워,까페 사장님  넘넘 친절하시고강쥐들 아주 많은데도 청결하게 까페관리하시고 아가들 진짜 다 천사처럼 관리하시더라구요 모든 아이들 털이 다 반짝반짝 빛이나요강쥐들진짜 ㅜㅜ 지구 다 뿌셔넘 다 귀여워요 강쥐들이 세상 교육 잘받아서 다 착해요 오늘 슈슈 코코 찰스 로이 에디 율무 버찌 폼폼 망고목화 솜이 밤톨이 모두에게 폴인럽 해버렸어요 저녁 밥시간되면 냐오냐옹 사장님 부르는나날이 한시간씩 사장님 호출시간 빨라지는 흰고영희도 넘 사랑스러벘어요 자주갈께요,5.0,6,5.0,0
더귀여워,너무 귀여워요 ㅎㅎ,5.0,1,5.0,0
더귀여워,처음에 갔을땐 호기심으로 방문했는데 와보니 강아지들도 너무 귀엽고 애교도 너무 많아서 힐링 됐어요 너무 만족스러웠고 지금까지도 자주 찾아가는 장소 중 하나입니다 사장님도 너무 친절하셨어요 ㅠㅠ,5.0,1,5.0,0
더귀여워,다른 애견카페는 강아지들이 엄청 오는데여긴 아예 강아지들이 안오네요ㅜ이런데는 처음이라서 올립니다,1.0,1,1.0,1
더귀여워,별점 한 개도 아깝네요 진짜로 오지 마세요 강아지들 손길 자체를 거부하고 주인한테만 갈라고하는 분위기여서 애견 카페에 온건지 남의 집에 놀러와서 억지로 껴서 노는건지 잘 모르겠고 너무 최악이네요 손도 물릴 뻔 하고 물릴 뻔한 저한테 카페 직원은 그렇게 만지면 안된다 할 뿐 고객한테 대하는 태도가 엉망이네요 절대 오지 마세요,1.0,6,1.0,1
더귀여워,강아지들이 다 피곤해보이고 서로 싸우고 손님들이 다들 간식주니까 간식없으면 오지도 않았어요ㅠ 눈밑에 눈물자국 심하구 애들 눈이 빨개가지구 힘들어보였어요 뭔가 애견카페 이제 슬퍼서 못갈것 같네요,2.0,16,3.3,1
더귀여워,치즈은 귀여운데 애들 간식을 안챙겨줘요사장님가강아지를못다루시는듯,2.0,21,3.5,1
더귀여워,일단 깨끗해서  좋았고 강아지 냄새도 안나서 좋았습니다 강아지친구들도 냄새가안났구요,5.0,1,5.0,0
더귀여워,식탐 많지만 통통하고 지방이 많아 포동포동한 로이찰스코코포메가족 밤톨퐁퐁율무자몽버찌 너무 귀여웠습니다겁나 멋진 슈슈와 침흘리개 뿌꾸 신발도둑 에디다들 개성만점 강얼쥐들이였고 매력이 넘쳤습니다개춘기가 와서 뾰루퉁해진 후추 왜 삐진걸까요ㅎㅎ처음에 갔을때는 강아지들이 저한테 많은 관심은 없었지만 두번째방문부터는 기억해주더라고요심쿵했습니다재밌게 놀고 장난치는 비쑝 자매 보면서 시간가는줄 모르고 있었네요 강아지들이 웃고있어서 더귀엽고 예뻐보였습니다퐁포로포봉퐁퐁퐁,5.0,2,5.0,0
더귀여워,가지마세요 정말고양이들은 만져보면 삐쩍 말랐구 강아지들은 오는 손님마다 주는 무분별한 간식에 죄다 귀긁고 생식기 핥고 키크고 안경쓴 한 직원은 자기가 뭐라도되는듯 손님들 앞에서 보란듯이 강아지들 데리고 같지도않은 이상한행동 계속 시키고 강아지들 들어서 방석에 내리꽂는 시늉하고 고양이들은 가만히 자는애들 계속 억지로 들어올려서 다른데로 옮기고 진짜 이상했어요 학대나 다름없었어서 진짜 화났어요 다신 안갈거에요 애견카페가는 분들 적어도 간식은 주지마세요 달고 짜고 나쁜거 다들어간 간식으로 잠깐 강아지들 관심사지만 걔네는 병원도 못가고 계속 긁어요정말 오랜만에 잊고있다가 와본 애견카페인데 여길 계기로 실내애견카페는 다시는 안갈거에요외부에서 뛰어놀수있고 동물들을 위해 간식금지하고 상주하느라 스트레스 받는 강아지가 적은 곳이 진짜 동물을 위한 카페에요 서울의 대부분 실내애견카페는 여기보단 덜할뿐 동물들을 하루종일 실내에 놓고 많은 사람을 만나게 한다는것 자체가 학대입니다,1.0,19,2.8,1
더귀여워,분 있다 나왔습니다 스트레스만 받았어요진짜 최악의 애견카페 였습니다 사장님은 꼭 보고 반성 하셨으면 좋겠네요수십군데를 다녀봤지만 이만큼 관리도 안되는곳은 처음 봅니다강아지들을 알면서 상업적으로 이용하는건지 관리를 안하는건지 원짜리 간식 손님들한테 팔려고 갯수 제한도 없이 팔아서 강아지들은 하루 종일 간식만 찾아다니고 많이 먹이고 손님들은 간식 안주면 강아지들이 근처에 오지도 않으니까 계속 간식 사다가 먹입니다 배가 엄청 빵빵해질때까지 간식만 먹더라구요 소형견들 까지도 하루종일 손 앉아엎드려만 시키고 있어요 손님들이그리고 나이 제한도 제대로 안둬서 초등학생들끼리 와서 강아지 때리고 괴롭히고 들었다놨다 케이지에 집어넣고 동물원 동물들한테 먹이 주는거 처럼 강아지들 스트레스 주는데 직원들은 관리 조차도 안하고 제지도 안합니다또 사장 딸인지 자주 오는 애인지는 모르겠는데초등학생 여자애 한명은 강아지가 싫다는데도 계속  훈련아닌 훈련 시키고 강아지가 안할려고 하면 때릴려 하더라구요 카페에 있는 모든 강아지들한테 그러더라구요 다른 손님들도 눈쌀을 찌푸리고 있구요강아지를 좋아하는 사람으로써 애견카페 자주 가는데 내돈 내고 강아지들 힘들어하고 하루종일 스트레스 받는걸 보고 열이 너무 받더라구요 거의 강아지들이 학대당하고 있는 느낌이였어요고양이존은 말할 필요도 없구요진짜 동물보호협회에 신고라도 하고 싶은 심정입니다저만 이렇게 느낀게 아니라 평 보니 다 가보신분들은비슷한 감정인거같아요 강아지들이 너무 불쌍하네요,1.0,4,2.0,1
