name,review,star,review_num,ave_star,label
핸드릭스커피로스터스,까페디져트 고인물이라 왠만해선 감흥없는데 첫입에 오싶었던거 오랜만 가게는 조금 답답한편인데 인석이 많아서 좋았슴,4.0,169,4.1,0
핸드릭스커피로스터스,와 라는 감탄사로 끝낼 수 있는커피 맛 분위기 쿠키,5.0,40,3.7,0
핸드릭스커피로스터스,존맛탱구리구리구리,5.0,280,3.8,0
핸드릭스커피로스터스,커피도 맛있고 분위기랑 음악도 너무 좋습니다,5.0,26,4.9,0
핸드릭스커피로스터스,사장님 이 존맛을 어디다가 표현할데가 없어서 너무 아쉬워용 진짜 존맛 적당히 달고 꾸덕하규 다른데서 파는 쿠키랑 퀄리티가 다름,5.0,117,3.7,0
핸드릭스커피로스터스,바깥이 엄청 예뻤고 내부는 어두운 컨셉으로 분위기 있었어용사장님은 아주 친절하셨고 커피는 먹다보니 산미가 올라왔어요,5.0,15,4.9,0
핸드릭스커피로스터스,이런 멋진 공간이 있었다니사장님이 엄청 디테일 하신 분 같더라고요여기저기 신경쓴 부분이 느껴졌어요커피도 맛있고 자주 오고 싶은 곳,5.0,245,3.9,0
핸드릭스커피로스터스,음악좋고 어두컴컴하니 최고 드립커피도 수준급,5.0,493,3.8,0
핸드릭스커피로스터스,커피 음악 쿠키 공간 모두 좋았어요 자주 방문하고픈 곳 ,5.0,122,4.1,0
핸드릭스커피로스터스,조용하고 커피도 맛납니다 아 쿠키도 괜찮았어요,5.0,14,4.1,0
사운드카페 소리,나만 갈 거야 오지마요 ㅜㅜ,5.0,141,4.1,0
사운드카페 소리,맥스 생맥주도 기깔 나지만 음향이 감동적인 곳,5.0,104,3.3,0
사운드카페 소리,최고 안주도 맛있고 술도 맛있고 음악도 맛있다,5.0,13,5.0,0
사운드카페 소리,분위기 깡패에요 종류도 많고 넘 조아요,5.0,1,5.0,0
사운드카페 소리, 정서방네와,4.0,"1,395",3.2,0
멍멍벅스,서비스를 이용하는 고객 입장에서강아지를 한 마리만 놓고 운영을 하는게  이해가 안되네요 한 마리만 볼 생각이었다면강아지 두세 마리 있는 일반 카페를 갔을 것 같네요최소한 입장 전에라도 오늘은 강아지가한마리밖에 없으니 참고하시라고 말씀만 주셨어도 이를 감안하고 입장하거나 다른 곳을 갔을겁니다 강아지가 한마리인 탓에 고객 근처에 강아지도 없는데 먼저 아무 조치도 취하지 않네요저희는 강아지를 보러왔지 일반 병음료 두개에만원도 넘는 돈으로 사먹으러 온게 아닙니다가게 운영하시는 것 보고 입장하고 얼마 안돼서 나왔네요 참고하시기 바랍니다,1.0,1,1.0,1
멍멍벅스,음료는 얼음만가득 채우고실내 실외는 지린내 가득너무 지저분해요,1.0,2,3.0,1
멍멍벅스,멍멍식당에서 삼겹살 먹었는데 강아지와 편하게 고기 먹을수있어서 너무 좋았습니다 프라이빗한 공간이라 주변 눈치도 안보이구요 몇번 이용했는데 알아보시고 서비스 주셔서 감동했습니다 또 갑니다,5.0,1,5.0,0
멍멍벅스,날씨가 선선해서 댕댕이와 같이 갈곳을 찾다가 방문했어용운동장 넓고 댕댕이 너무 좋아해서 신나게 뛰다갑니다직원분들도 친절하고 실내도 층까지있어서 넓고 쾌적해요,5.0,1,5.0,0
멍멍벅스,번화가에 이런 넓은 카페가 있다니강아지들이 너무 좋아하네요,5.0,22,3.6,0
할리스 홍대역2번출구점,친절함 전망 좋은편임,5.0,62,3.7,0
할리스 홍대역2번출구점,공부하기 좋은 좌석 많은 건 말해뭐해 아늑하고 좋아요 근데 며칠 전에 층에서 사이비 종교 신도들로 추정되는 사람들이 북적북적하게 모여서 놀랐습니다 근처에 집결지 있다고 들었었는데 찐인가 봐요 다들 조심하세요,4.0,24,3.5,0
할리스 홍대역2번출구점,친절하고 좋다 외국인 손님들이 너무 시끄럽게 하는 것과 짐두고 자리비운 사람이 많은 것 빼면 좋은 자리 다 맡아두고는 한참을 비우다니 도서관도 아니고 아래 댓글 보니 기가 막히네요 기본적으로 비상식적인 일인데 누가 말해줘야 안다니 누가 내짐에 손대는 게 싫으면 카페에서 잠깐 동안 말고는 자리를 비우지 말아야죠 인터넷의 황당 사례를 눈으로 목격하네요 카페에서 짐두고 한참 자리비우는 거 민폐예요 그 자리 다른 사람이 못쓰잖아요 어차피 앉아있어도 못 쓴다고요 그럼 앉아있어야지요 사람없는 자리를 다른 사람이 있다는 가정을 하고 이용못한다는 게 어불성설이지요 제발 그러지 마세요,4.0,58,3.6,0
할리스 홍대역2번출구점,공부하거나 책읽기 좋고 직원분들이 친절하세요,5.0,33,4.1,0
할리스 홍대역2번출구점,알바생이 주문 잘못 받아서 한참 기다림,1.0,57,1.9,1
할리스 홍대역2번출구점,조용하고 책읽기 좋아요,4.0,442,4.1,0
할리스 홍대역2번출구점,외부음식 반입 안돼요 여기서 안먹는거라도 반입 자체가 안됩니다 가실분들 참고하세요 알바분께서 좀 더 납득할만한 이유를 설명해주셨으면 하는 아쉬움이 있습니다 가방에 숨겨서 들어가는 손님은 괜찮은건가요,1.0,11,3.5,1
할리스 홍대역2번출구점,사전에 예고해주셨으면 모를 까 짐두고 자리비웠다고 그 짐을 손수 치우고 바구니에 넣어놔서 돌아왔는데 내물건이 없어져있어서 일단 황당했음내 물건에 남이 손대는 걸 극도로 싫어해 기분이 불쾌했고 내가 애도 아니고 짐두고 외출하면 안된다고 모든직원이 돌아가면서 총번을 말해서 더더욱 기분이 불쾌했다 짐을 치울거면 사전에 공지를 하던가 종이로 써놓고 붙여놓던지그리고 같은 말은 한번만 했으면 좋겠다내가 굳이 같은말을 번을 들어야 할필요가있을까,1.0,1,1.0,1
할리스 홍대역2번출구점,엄청 친절하고 깨끗하고주차도 가능하고맘에 들어요 ,5.0,43,4.3,0
할리스 홍대역2번출구점,분위기 좋고 맛도 좋음,5.0,184,3.8,0
할리스 홍대역2번출구점,점장님이신 것 같은데 정말 친절하세요 메뉴 설명도 잘해주십니다 근데 주로 공부하는 사람들이 많이 오는지 층은 넘 조용해요,5.0,92,2.5,0
할리스 홍대역2번출구점,층 앉았는데 직원분들 자기들끼리 웃고 떠드느라 너무 시끄러웠어요,1.0,1,1.0,1
할리스 홍대역2번출구점,남자 알바야 니가 먹고 갈건지 안물어보길래 당연히 테이크아웃컵으로 주는 건지 알았다 근데 유리컵에 주면서 먹고간다면서요 라니 ㅋㅋㅋ 난 그런 말 한적도 없고 안물어보길래 당연히 테이크아웃컵에 줄줄 알았거든ㅋㅋㅋ,1.0,84,1.7,1
할리스 홍대역2번출구점,층 층은 빨대도 없고 와이파이 비번도 없고운동많이 하게 하는 매장이네요 ㅎㅎ직원들도 너무성의없는 대답들  가시 오고싶지 않네요 할리스 큰곳 일수록 이런것 같음,1.0,18,1.7,1
할리스 홍대역2번출구점,생긴지 얼마안되어 깔끔하고 지하철역과 가까워 친구들과 과제 하기 좋아요,5.0,1,5.0,0
할리스 홍대역2번출구점,최악의 와이파이 속도 사람 많은 층에서와이파이 속도 측정했는데 나옴 와이파이좀 설치해야 할 듯사람도 많은데인테리어는 정말 좋음 특히 층은 마포구 서대문구에서 제일 좋을듯추가  와이파이가 새로 생김이제 홍대에 있는 할리스 중에 이곳이 최고가 되었음,2.0,21,4.0,1
할리스 홍대역2번출구점,카공하기 딱 좋은듯 그래서 늦게 가면 자리 구하기는 쉽지 않음에어컨이 조금 추우니 겉옷 가져가는 걸 추천,4.0,8,4.6,0
할리스 홍대역2번출구점,카공족 위한 자리가 많은데 와이파이가 안됨 이 무슨,2.0,4,3.8,1
할리스 홍대역2번출구점,와이파이 빵빵하고다른 카페들과 달리 청소가 잘되는 매장인것 같아요 긴 머리 여성분들한번쯤은 의자 뒤로 머리는 고쳐 묶다 떨어뜨려 본 기억 한번쯤은 다 있죠먼지 엉겨붙은 머리끈을 주울 각오하고 들어올렸는데 어맛 먼지가 하나도 안붙어있어서 깜놀했어요 여기저기 보니 주위 구석구석 꽤 깨끗해서 놀랐어요,5.0,1,5.0,0
할리스 홍대역2번출구점,인터넷이안되요,2.0,6,3.7,1
할리스 홍대역2번출구점,적절한 소음충분한 공간층까지 있음공부나 과제하기 좋은 곳,5.0,112,4.3,0
할리스 홍대역2번출구점,인터넷 안돼요,2.0,13,4.5,1
카페아벨롭,의자테이블도 엄청 좁고 불편하고 공간도 애매하게 나눠져있음값만 비싸고 이 카페의 메리트가 없다는 생각이 계속 들던 곳,1.0,19,3.7,1
카페아벨롭,골목 안쪽에 있는데 인테리어도 너무 예쁘고 커피도 쫀쫀하니 맛있어요 커피 원두도 고를 수 있어서 좋아요,4.0,565,4.3,0
카페아벨롭,원두종류 선택할 수 있고  산미있는원두의 플래화이트 맛있네요  애플파이 커피랑 먹기 좋아요  분위기도 도 좋지만 직원분들 상냥하세요  힙하면서 편한한 맛난 커피까지 기분좋은 오후시간을 보냈습니다 ,5.0,6,4.8,0
로스팅마스터즈 본점,커피 맛집 초콜렛 맛집 역시 여기서는 시그니처를 먹어야,5.0,15,3.6,0
로스팅마스터즈 본점,초콜렛이 미쳣어요,5.0,82,4.4,0
로스팅마스터즈 본점,음악이 너무 별로에요ㅠ아니 똑같은 음악이 계속 무한반복되네요 음악소리도 크구요 그거빼곤 다 좋아요,2.0,119,3.5,1
로스팅마스터즈 본점,이따금씩 좋은 커피와 좋은 초콜렛이 먹고싶을때 들립니다사장님의 커피에 대한 진심이 맛으로 연결되는 좋은 카페입니다바리스타가 드립 내리고 직접 맛 확인한뒤 손님한테 내주는 모습이 요즘 은 흔치 않은데이 작업을 항상 해주시는것만봐도 이 분들 정말 멋진분 들이네요커피맛으로 감동받은 시간이었습니다 감사합니다,5.0,2,5.0,0
로스팅마스터즈 본점,초콜렛 진짜 맛있어요 멜팅초코 꼭 드시길 강추,5.0,33,4.0,0
로스팅마스터즈 본점,커피보단 초콜릿,5.0,81,4.1,0
로스팅마스터즈 본점,원두 맛나요,5.0,13,4.7,0
로스팅마스터즈 본점,점주고 싶은데 나만 가고 싶어서 점 드림 친절하지는 않고 마실 수 있는 자리도 없고 쵸콜릿은 드럽게 비싸지만 맛이 다 카바침 커알못이 먹어도 원두가 장난없다는게 느껴질 정도로 대존맛 커피에서 꽃향이 느껴짐사실 커피는 맛 감안하면 오히려 싼편초콜릿도 여유되면 먹어보는걸 추천함,4.0,69,4.2,0
로스팅마스터즈 본점,원두 진짜 대존맛,5.0,18,3.2,0
로스팅마스터즈 본점,자기만 가고싶어서 별점깎는 사람이 저는 참 별로라고 생각해요,5.0,33,3.8,0
파도,반했어요눈 쌓인 입구가 예뻤고 자개로 디자인한 입간판 색색깔 한복 단정하게 정돈된 작품과 굿즈들 파도 바다라는 이름의 메뉴들 두유옵션이 기본인 것사랑합니다 유리빨대 그리고 컵과 컵받침과 냅킨 모두에 박혀있는 파도 로고 유리창 바로 바깥에 놓여있는 고양이 밥과 물 창 너머로 마주친 고양이들 반지 하나조차 정성껏 포장해주는 세심함 디테일 하나하나에 감탄했어요 여성작가 중심의 복합문화공간인 것도 너무 좋아요좌석은  기준으로 실내에 총 세 테이블인석인석인석 야외에 총 두 테이블모두 인석 있었어요처음 방문했는데 더 자주 찾아가고 싶어요 ,5.0,6,5.0,0
파도,분위기도 너무 좋고 직원웅니도 짱 친절해요,5.0,3,2.7,0
파도,분위기가 정말 역대급이었어요 인테리어 하나하나 다 너무 예뻤고 음료도 맛있고 친절하셨어요,5.0,38,4.6,0
파도,분위기도 인센스 스틱 향도 서비스도 맛도 완벽하고 너무 좋아요 또 올거예요,5.0,29,4.0,0
파도,자리가 협소하고 다소 불편하다는 걸 제하면 모두 좋습니다멋진 굿즈도 많고 비건 옵션이 있습니다,5.0,424,4.4,0
파도,분위기 넘 좋아요 음료랑 브라우니도 맛있어요자리는 조금 협소합니다,4.0,63,4.2,0
파도,갈때마다 감탄하는곳 항상 응원하는 공간 작가님들의 전시도 자주 해서 너무 좋음,5.0,47,4.1,0
파도,최고 분위기 좋고 사장님들 친절함이 하늘을 뚫음,5.0,25,4.2,0
파도,최고의 카페또 갈거예용가면 굿즈 너무 예쁜 거 많아서 텅장 조심저는 속수무책으로 사버림,5.0,10,4.2,0
파도,사장님 직원분들 다 친절하시고 공간에 대한 애정이 느껴져요 가끔 오는 길 친구에게도 상냥하세요 맛있는 비건 음료에 멋진 굿즈들 다 너무 좋습니다,5.0,29,3.8,0
파도,카페 직원분들친절하고 공간 예쁘고 아늑하고 음료는 맛있습니다,5.0,14,2.9,0
파도,두루마기 구경하러 갔는데 아늑하고 예뻐요다음에 음료도 마셔보려고요,4.0,11,2.7,0
파도,분위기도 완벽하고 동양적 아름다움이 있는 카페 무엇보다 비건메뉴가 있어서 갈 수 밖에 없음,5.0,10,4.0,0
파도,음료가 다양해서 좋아요 예쁜건 덤,5.0,64,4.8,0
파도,다좋은데캄캄하고향수넴세가너무심해요,4.0,30,4.8,0
파도,조용하고 맛있고 모두 친절하심 작품들도 있어서 좋았어요,5.0,15,2.9,0
파도,음료도 맛있고 직원분들도 친절하시고 좋은 작가님들과 적극적으로 협력하셔서 너무 좋아요,5.0,16,4.6,0
파도,파도와 노을 머리묶으신 남자직원분이 정말정말 친절하세요유리빨대를 떨어뜨려서 큰 소리가 났는데 음료 쏟진 않으셨지 옷은 더럽혀지지 않았는지 걱정하면서 세심히 정리해주셨어요분위기 맛 서비스 최고 ,4.0,444,3.7,0
커피빈 동교동삼거리점,카페 넓어서 공부하기 좋고 직원분들도 친절해서 홍대에서 공부할때 항상 여기서 합니다 ,5.0,41,4.4,0
커피빈 동교동삼거리점,위치좋아서 자주 가게됨 안에 자리 넓직하고 공부하기도 괜찮아요,4.0,86,3.7,0
커피빈 동교동삼거리점,조용해요,5.0,24,5.0,0
커피빈 동교동삼거리점,여직원들이 표정이 어둡고 불친절함 커피도 그닥 ,1.0,1,1.0,1
커피빈 동교동삼거리점,바닥청소를 안하시는듯,2.0,16,2.7,1
커피빈 동교동삼거리점,조용하고 직원들 친절해서 좋아요,5.0,8,2.6,0
커피빈 동교동삼거리점,커피빈은 콘센트가 없음,1.0,46,1.8,1
커피빈 동교동삼거리점,좋아요,5.0,47,3.3,0
디비스토리 홍대카페,다른 매장에 비해 저렴하고 재료가 다양해요집중해서 만드느라 마감 시간까지 계속 있었는데도 직원분들께서 친절하게 대해주셨어요덕분에 친구와 좋은 추억을 만들었어요,5.0,28,4.6,0
디비스토리 홍대카페,이런곳이 있었다니  신기하네요서울관광 명소로외국 사이트에도 소개되었다고 하는데이제야 와봤습니다,5.0,62,2.3,0
이제마스터디클럽 홍대점,음료도 하나 무료로 줘서 아주 좋아요쾌적하고 일하시는 분들도 친절해요,5.0,31,3.3,0
이제마스터디클럽 홍대점,좋음,5.0,3,4.0,0
이제마스터디클럽 홍대점,서비스도 좋고 모든 스터디카페 중에서 가장 쾌적해요 그리고 올데이하면 직접 만들어주시는 음료도 세번 먹을 수 있어요 멤버십 가입하면 가격할인도 돼서 좋아용,5.0,45,5.0,0
이제마스터디클럽 홍대점,카페보다 좋아요,5.0,28,4.3,0
이제마스터디클럽 홍대점,조용하고 가격도 착하고 좋네영,5.0,1,5.0,0
손탁커피 본점,유명한 곳인 모양인데 제가 몰라보고 메뉴를 어설프게 물어보니 기분이 안 좋으신지 태도가 좀 불쾌하네요 맛은 괜찮았습니다 가격도 상당하던데 이런 대접 받으며 먹어야하나 있는 내내 고민했습니다 몰라봬서 죄송합니다,2.0,33,4.1,1
손탁커피 본점,말이 필요없는 곳,5.0,1,5.0,0
손탁커피 본점,굳이 찾아서 갔는데 드립커피가 주력이라기엔 맛이ㅠㅠ 라떼는 괜찮던데,2.0,203,2.9,1
손탁커피 본점,맛잇엉,5.0,78,3.9,0
아스트로노머스커피,드립 커피가 맛있어요,5.0,206,4.1,0
아스트로노머스커피,      ,5.0,19,4.6,0
아스트로노머스커피,묵직한 커피 마시고 싶어 에스프레소는 시켰으나 산미와 달큰한 맛은 또 놓치고 싶지 않아 플루토 원두로 주문했다 향기와 풍미가 엄청나서 완전 만족 ,5.0,7,4.9,0
아스트로노머스커피,살면서 커피가 맛있을 수 있다는걸 알려준 카페입니다,5.0,4,5.0,0
아스트로노머스커피,친구셋이랑 같이 가서 마신 적있는데 뭐만하면 다 자기 마음에 안 든다는 듯이 우리보고 계속 명령함자리 옮기면 좀 해주시겠어요  좀 하시겠어요기분나쁜 투는 아닌데 밑에 장문 댓글쓴이 분이 무슨 말 하는지 알겠음 ㅋㅋㅋ 우리가 진상짓 한 것도 아니고 서울 놀러와서 짐도 좀 많은 상태로 동네 카페가서 커피 좀 마시겠다는데 그게 마음에 안 들면 걍 손님 받지 마세요 매우 기분나빴던 경험,1.0,8,2.6,1
아스트로노머스커피,바닐라 라떼 한잔 테이크아웃로투스 맛이 남즐거운 경험,5.0,7,3.3,0
아스트로노머스커피,산미를 좋아하지 않지만 이집은 예외로 맛있음 연남동 가면 꼭 들르는 집,5.0,167,4.4,0
아스트로노머스커피,친절하고요커피도 맛있어요자주 갈 것 같아요,5.0,338,4.4,0
아스트로노머스커피,지하냄새와 꿉꿉함이 저에겐 너무 심하게 와닿아서 있는동안 불편햇어요괜히 주문했다 요느낌후딱먹고 나갔습니다커피가 맛없고 불친절하고 그런건 전혀아니고요그냥 공간에 대한 불편함이 가득,2.0,480,3.5,1
아스트로노머스커피,사장님인지 종업원인지는 모르겠지만 지난 주말 저녁에 있던 남자분  친절함과 배려심이 아쉬워서 한 마디 남깁니다주문할 때부터 마시고 나올 때까지 기분이 썩 좋지는 않았습니다 반주삼아 저녁을 먹고 친구가 분위기 좋은 커피 샵이 있다고 해서 가 봤는데 기분만 잡치고 나왔습니다 참고로 전 일본의 분위기 있는 커피숍에 관한 책을 번역한 적이 있습니다 거기에는 규모는 작지만 나름대로 개성을 가지고 독특한 분위기를 자아내면서 오랜 단골들을 가지고 있는 곳들이었습니다오랫동안 유지한다는 것은 커피맛이라든가 분위기만 좋아서 되는 것이 아니고 커피를 타는 사장님의마음까지 다 녹아들어 비로소 제대로 된 명품 커피점이 되는 것입니다다른 것은 모르겠고 배려심이 좀 있었으면 좀 더 좋은 시간이 되었지 않았나 싶어 한 글 남깁니다모든 사람들이 다 그 집의 커피에 익숙한 것은 아닙니다 어떤 커피냐고 물어볼 수 도 있고 글자가 잘 안보일 수도 있습니다주문대에 있는 메뉴판도 너무 작습니다 좀 더 친절한 설명이 필요해 보입니다귀찮다는 듯한 표정과 말은 그 커피숍에서 빨리 나오고 싶어지는 마음 밖에 생기지 않습니다중년 남자 셋이라 그 곳 분위기와 안울리니 손님을  안 받았으면 하는 마음이 밖으로 표출된 것 같았습니다 나이트클럽의 물관리하는 듯한 분위기차를 마시다보니 대기하고 있는 듯한 무리명가 있기에 친구가 다른사람들 기다린다며 빨리 자릴 비워주자고 하더군요 인용 자리는 두 곳 정도 거리를 두고 비워져 있었지만 따로 있어서 우리가 비워주면  같이 붙여서 앉을 수 있을 것 같아 좋은 마음에서 일찍 일어나기로 했습니다 일어나면서 친구가 사장님이 혼자라서 바빠 보이니  나가면서 커피잔을 우리가 들고 가져다 주자고 하더 군요우리는 모두 명이었는데 먼저 나간 친구 빼고 내가 옷을 챙기며 양손에 하나씩 잡고 다른 친구가 한개를 들고 카운터에 가져다 주었습니다그러면서 바쁘신 것 같아서 커피잔을 가지고 왔습니다하고 웃으면서 올려놓는데 사장님 왈  그 자리에 그냥 두는 것이 도와주는 겁니다 라고 하더군요순간 어이가 없어지며 이게 요즘 젊은 사람들의 화법인가 하는 생각이 들더군요설사 그렇다 하더라도 그냥  예 감사합니다 라는 말을 못하는가 하는 마음이 들면서 화가 나더군요가능하면 꼰대라는 소리 듣고 싶지 않고 나도 젊은 사람들을 많이 상대하는 편이라 이해하려고 했지만 그 곳은 영업점이고 기분 좋게 차를 마시는 곳이라 최소한 사장님이라면 그런 마인드로는 좀 곤란하지 않을까하는 마음에 시간 들여 후기를 남깁니다 역지사지의 마음을 가졌으면 합니다 그 날 혹시 기분 안좋은 일이 있었는 지는 모르지만 기분 좋게 차 마시러 왔다가 기분 상해서 돌아가는 일이 없었으면 합니다차를 맛있게 타려는 마음에다 손님에게 잘 접객해야겠다는 마음씨까지 더해진다면 더 좋은 커피숍이 되지 않을 까 싶습니다어지간하면 이런 글 남기지 않는데 꼭 후기를 남겨야겠다는 마음이 들었습니다 마음에 새기시고 더욱 번창하시길 빌겠습니다,1.0,4,2.0,1
아스트로노머스커피,연남에서 커피 잘 하는 집 분위기도 좋고 늘 친절하게 대해주셔서 감사드려요,5.0,54,3.5,0
아스트로노머스커피,라떼가 진짜 맛있어요,5.0,29,3.6,0
아스트로노머스커피,커피 맛있고 매장분위기 좋은곳,5.0,10,5.0,0
아스트로노머스커피,라떼맛집 ,4.0,170,3.6,0
아스트로노머스커피,사장님이 친절하고 커피가 맛있습니다다만 양이 너무 적어서 아쉽습니다ㅠㅠ,4.0,199,4.0,0
아스트로노머스커피,아인슈페너 너무 맛있게 잘 먹었고 사장님이 정말 친절하세요,4.0,227,4.1,0
아스트로노머스커피,커피 전문점 원두 종류 다양한데 전체적으로 맛있고 맛있게 내려주십니다라떼랑 필터커피 둘다 만족스러웠어요인테리어도 아늑해요,5.0,32,4.1,0
아스트로노머스커피,굿이다 굿 타입 깔끔 상큼 과일주스마냥 쭉쭉 들어가네요,5.0,363,4.0,0
아스트로노머스커피,테이크아웃으로 먹었는데 커피맛 너무 좋았음ㅠㅠ,5.0,71,4.5,0
아스트로노머스커피,들어가자마자 고양이 덩 냄새가 너무ㅠㅠㅠ 고양이 좋아하지만저 냄새 안에서 커피를 느낄수가 없을 듯 해요찐고양이러버만이 가는 곳인 듯,1.0,23,3.3,1
아스트로노머스커피,   ,5.0,1,5.0,0
아스트로노머스커피,커피도 맛있고 아늑해요 어둑어둑한 분위기도 좋고 조용해서 너무 좋아요 고양이가 왔다갔다 하는 것도 너무 귀엽고 좋습니다,5.0,38,3.8,0
아스트로노머스커피,아스트로노머스 라떼찐행복,5.0,125,4.4,0
아스트로노머스커피,오랜 단골입니다 친절하고 맛있고 저렴합니다 요즘엔 특히나 척만 하는 카페가 많은데 이곳은 커피도 잘 하시고 커피를 참 좋아하시는 분들이 만든 공간같습니다,5.0,39,3.7,0
아스트로노머스커피,오 맛있어요  잔 더 많이 마실 수 있을 것 같아요ㅎㅎ 다 마시고 나서 커피냄새가 나서 넘 좋아요글구 되게 무척 친절하세요 굿굿 또 마시러 가야지,5.0,9,4.9,0
아스트로노머스커피,가야는이유  두 가지 블렌드가 극명히 달라 독특했던안가는이유  매장 에어컨이 너무 추움플루토 아메리카노  첫맛이 써서 당황했지만 시간이 지날수록 산미가 풍부하게 느껴지는 코스믹더스트 라떼  곡물의 고소함과 구수함이 강한 블렌딩매장 가격이 저렴한 편은 아니나 투고는 천원 할인,4.0,"3,516",3.3,0
아스트로노머스커피,지나가다 전문적으로 보여 들렀는데 추천해요 아아 타입 산미에 깜짝 앤드 다채로운 꽃향에 깜짝 테이크아웃은 할인도 되요 만족만족,5.0,122,3.6,0
아스트로노머스커피,여기 라떼 짱맛임 완전 고소하구 부드러움,5.0,50,3.7,0
아스트로노머스커피,음악 좋고 드립커피도 가격 적절하고 맛있습니다 분위기 또한 아지트 스러워서 좋아요,5.0,23,4.7,0
아스트로노머스커피,저희 집 앞으로 이사 와주세여 ㅜㅜ 인생 아이스라떼 만났어요,5.0,90,3.7,0
아스트로노머스커피,깔끔한 커피,4.0,11,3.8,0
아스트로노머스커피,년 전부터 더운 날 마시던 아이스 라떼는 예나 지금이나 한결같은 맛이다 우유와 커피의 밸런스가 좋고 고소하고 깔끔한 뒷맛이 너무 좋다 원두는 묵직한 맛과 산뜻한 맛 두가지 중 선택할 수 있다,5.0,38,3.6,0
아스트로노머스커피,커피 맛있어요 ,5.0,1,5.0,0
아스트로노머스커피,구림,1.0,66,3.3,1
오월일일,불 켜 있을 때 골목에 편안한 분위기 조성 장신구용 커피,2.0,147,2.1,1
오월일일,디저트랑 커피랑 전부 맛있어요 다쿠아즈 대박 케이크도 후,5.0,16,3.1,0
