name,review,star,review_num,ave_star,label
투썸플레이스 을지로입구역점,쑥라떼를 시켰는데 커피향이 나길래 이거 잘못나온것같다고 했더니 숏카페라떼 시킨줄알았다며 쑥라떼는 원 추가되는데 괜찮으세요라고 했다안괜찮다고 하면 환불을 해줬을까 주문실수에대한 사과가 먼저 나왔어야하지 안괜찮다고 할껄그리고 화장실하 청소를 안하나 못볼꼴봤다불쾌한 장소이다 앞에 스벅을 갈껄와쑥라떼 원 추가하고 받았는데 겁나 미지근하네요에휴,1.0,14,3.4,1
투썸플레이스 을지로입구역점,주말 오후 시간에 일하고 있는 여직원 싸가지가 없어도 너무 없어요 ㅡㅡ누가 들어도 띠껍다는 느낌 팍팍 내면서 싸가지없는 말투로 안내하는데 직원 교육상태가 영 엉망이다 싶었습니다,1.0,1,1.0,1
투썸플레이스 을지로입구역점,넓찍해서 잠시 쉬어가기 좋았음 하지만 크고 회사가 주변에 많은 곳인 만큼 저녁 때 술 먹고 차로 카페 온 직장인 무리가 많았음,4.0,78,4.4,0
투썸플레이스 을지로입구역점,생긴지 얼마 안됐는지 넓고 깨끗합니다 직원분도 친절했어요,5.0,11,2.8,0
투썸플레이스 을지로입구역점,밑에분 투썸 직원인가요여자직원분 정말 불친절해요돈내고 불쾌감 느끼고 싶으신 분 가세요,1.0,7,2.4,1
투썸플레이스 을지로입구역점,한국전력공사 서울본부 층에 위치한 대형 커피 전문점년 월 개점 직영,5.0,189,4.8,0
투썸플레이스 을지로입구역점,알바생이 너무 친절해요,5.0,84,2.1,0
빽다방 을지로입구역점,싸서 자주가는곳 ,5.0,60,2.7,0
빽다방 을지로입구역점,주말낮직원친절조용하게잘쉬다갑니다,5.0,551,3.7,0
빽다방 을지로입구역점,친절하고 가성비 좋습니다,5.0,2,5.0,0
빽다방 을지로입구역점,남자 알바 없음 주문 받을 때 부터 신경질적으로 대답하고 진짜 싸가지 없네요 친구가 먼저 주문하고 알바가 바로 커피 만들길래 친구랑 얘기하면서 기다리고 있는데 커피 기계 소리 때문에 뭐라하는지 못들어서 다시 물었더니 그니까 뭐 드실거냐구요 ㅡㅡ 이런식으로 대답의 연속이었네요,1.0,16,3.8,1
빽다방 을지로입구역점,여자 알바 싸가지 ㅋㅋ 상상초월 그럴꺼 서비스직종에서 왜일함 분명 본인도 돈필요해서 일하는거면서 물건 엄청쎄게 놓고  냅킨도 안채우고 뭐달라하면 다 없다고 ㅋㅋ,1.0,37,3.1,1
빽다방 을지로입구역점,여기 잘생긴 남자 알바는 친절여자 알바 한명 특히 불친절,1.0,9,1.2,1
할리스 광화문점,굿,5.0,1,5.0,0
할리스 광화문점,알바생 남자분 진짜 너무 너무 무서워서 그냥 나왔어요 앞에 주문하신분 커피가 나온건가본데 데스크 쾅쾅치면서 쾅아 주문하신분 쾅쾅 뭐뭐 주문하신분 쾅쾅쾅 뭐뭐 주문하신분 고래고래 소리지르더라는 너어무 무서워서 그냥나왔어요 글로 그 상황이 다 안담기는데 진짜 주문하셨던 남자분이 착하셨기에 망정이지 더위 피하려다가 싸움구경 할뻔했어요 싸우고싶어서 몸이 근질거리시나 결투신청인줄 금요일 시사이쯤이었네요 매장청소도 안하는지 더러웠음,1.0,43,3.1,1
할리스 광화문점,어제 낮에 갔는데 손님 네명만 있고 한산했거든요딸기 스무디인가 그거 되냐고 물어봤더니 마스크 낀 상태로대놓고 한숨 쉬고는 원이라고 하는데 응대하는 꼬라지가 그게 뭡니까 상전 받드는 수준을 바란건 아니지만 마스크 꼈다고 면전에서 한숨쉬는게 말이 되냐고요 교육 똑바로 안 시켜요,1.0,9,2.4,1
할리스 광화문점,어제 낮에 갔는데 손님 네명만 있고 한산했거든요딸기 스무디인가 그거 되냐고 물어봤더니 마스크 낀 상태로대놓고 한숨 쉬고는 원이라고 하는데 응대하는 꼬라지가 그게 뭡니까 상전 받드는 수준을 바란건 아니지만 마스크 꼈다고 면전에서 한숨쉬는게 말이 되냐고요 교육 똑바로 안 시켜요,1.0,9,2.4,1
공차 명동점,펄 양 적고 딱딱하구 맛 없음,1.0,20,3.9,1
공차 명동점,불친절하네요 알바생좀 제발 기본만이라두 하세요,1.0,7,1.1,1
공차 명동점,시부터 영업시간이라고 써있는데 시 분에 갔는데 오픈을 안했어요,2.0,2,3.0,1
공차 명동점,스무디 시켰는데 완전 녹은 상태로 받았습니다 커피 샷 때문에 그렇다고 하는데 나중에 인터넷 보니 그냥 핑계였네요 제발 그 정도로 망쳐서 만들었으면 환불해주겠다거나 다시 만들어주겠다고 하세요,1.0,1,1.0,1
공차 명동점,평일 시반쯤 방문했는데 알바생이 짜증을 내네요 진짜 정말 기분이 나빴습니다 알바생 교육 똑바로 하세요 알바가 인성 밥말아먹은듯,1.0,2,1.0,1
공차 명동점,나이 드신 아줌마 알바인지 사장임지 대답도 안하고 꼬라볼거면 일하지마요 ㅋㅋ 젊은 사람만 다 하네 어후 ㅉㅉ 주문도 안받고 음료 제작도 안하고 맨날 가만히 있으면서 도대체 왜 있는지 진짜 한숨만 나오네요,1.0,51,3.0,1
공차 명동점,                      ,1.0,3,2.7,1
공차 명동점,좋아요,4.0,2,2.5,0
공차 명동점,공차도은근 점바점심한데 여기는 잘해주는듯,5.0,383,4.1,0
공차 명동점,넘 맛있어요ㅠㅡㄴ,5.0,13,4.3,0
공차 명동점,프랜차이즈라 뭐 어딜가나 비슷한 맛이긴한데 타로밀크티 매니아라 자주가네요 ㅎㅎ 딱히 빠지는점 없고 만족합니다,5.0,57,3.4,0
공차 명동점,밀크폼 좋아해서 늘 추가를 하는데 여긴 정말 낙낙하게 주셨어요ㅠㅠ 사랑해요 누가 주셨는진 모르겠는데 이 직원 분 복 받으시길,5.0,149,4.4,0
공차 명동점,공차는 주문잘못받는게 업체 시그니천가다른지점인데도 이러네ㅋㅋㅋ,2.0,79,1.8,1
공차 명동점,리뷰 잘안남기는데 여기는 알바생표정도 그렇고 맛이 너무 연하달까 음료덜탄게느껴짐,2.0,8,1.8,1
공차 명동점,펄 상태좋음,5.0,239,3.7,0
공차 명동점,맛잇음 친절,5.0,4,3.0,0
투썸플레이스 광화문역점,주말은 안 가봐서 모르겠는데 평일 오전오후에 계시는 여자 직원분들 세분 정도 항상 뵙는데 다들 진짜 친절하시고 센스있으시던데 왤케 악플이 많은지 모르겠네요 평소에 고정메뉴 마시는 게 있는데 요청사항도 기억해두셨다가 말씀 안 드려도 알아서 반영해주시고 정말 좋으세요 그래서 출근길에 다른 투썸있지만 저는 꼭 여기로 가요,5.0,2,5.0,0
투썸플레이스 광화문역점,할베 할마시들 많은게  만남의 광장인가요,5.0,31,3.7,0
투썸플레이스 광화문역점,정오에 가서  샌드위치와 아메리카노 세트를 주문했습니다 주문 시 남자 직원분이 주문 더블체크도 안하고 결제를 했고 결제 후 다른 여자 직원분께서 현재 샌드위치는 진열대에 진열되어 있는 게 전부라며 불친절한 태도를 보이더라구요 바쁜 시간에 동료 직원의 주문 실수 때문인지 수량 체크를 안한 미흡한 태도 때문인지 인내심이 부족한 모습을 손님들께 보여주는 느낌을 받았습니다 결국 샌드위치만 바꾸어 주문을 마쳤지만 음식을 받을 때 또 한번 실망을 했습니다 분명 같은 아메리카노를 주문하였고 샌드위치만 진열대에 있는걸로 바꾸었는데 음료가 라떼로 나왔더라구요 직원분께 말씀드렸더니 오더가 잘못 되었다며 라떼가 원 더 비싸다고 하더라구요 그래서요 죄송하다는 사과가 먼저 아닐까요 투썸 사상 최악의 경험이었습니다 진짜 매니저님 직원분들 교육 다시 시켜야 할 것 같습니다,1.0,17,3.2,1
투썸플레이스 광화문역점,여기 알바생 최악입니다 친절은 고사하고 기본 예의도 없습니다 담당 매니저분께서는 직원 교육부터 다시 제대로 하셔야 할 거 같습니다 다녀본 투썸 중 이런 곳은 없었습니다 최악입니다 별점 점도 아깝습니다,1.0,2,1.0,1
투썸플레이스 광화문역점,주문 하고 앉아 있으라네요 지금 바로 나갈때 주문하겠다 하니 주문 안하면 앉아 있을수 없다나층에서요 애 학원에 데이러 갈때 뭐라도 사려 하는데 텅텅빈 냉장고   그거야 그렇고 야박하긴 스벅이 그립네,1.0,1,1.0,1
투썸플레이스 광화문역점,알바생들 너무 불친절해요 ㅋㅋ 투썸 많이 가봤는데 여기가 서비스는 제일 최악,1.0,119,2.5,1
투썸플레이스 광화문역점,역 앞이라 가깝고알바하는 분들이 너무 친절해서 좋았어요그리고 요즘같은 시기에 위생이 많이 신경쓰이는데근처 다른카페들이랑 다르게 깨끗해서 좋았어요,5.0,2,3.0,0
투썸플레이스 광화문역점,역 바로 앞이고 조용해서 좋았어요,5.0,1,5.0,0
투썸플레이스 광화문역점,층에 바퀴벌레 발견,1.0,12,3.7,1
스타벅스 무교로점,친절하고자리많고 노래좋아여,4.0,51,3.7,0
스타벅스 무교로점,무교동이나 다동에서 모임 시만남장소로 굿조용 친절쓰,4.0,599,3.9,0
스타벅스 무교로점,친절하고 쾌적합니다 자리도 많음,5.0,4,5.0,0
스타벅스 무교로점,좋아요,5.0,43,4.9,0
스타벅스 무교로점,매장이 너무 예쁘고 좌석간 거리도 넓고 파트너분이 친절하세요 또 오고싶네요,5.0,30,4.9,0
스타벅스 무교로점,매일 아메리카노 먹는데 친절하고 맛있어요,5.0,6,4.3,0
스타벅스 무교로점,밝고 깨끗해요다들 친절하고 참 좋았어요ㅎㅎ,5.0,4,5.0,0
커피빈 을지로입구역점,스벅과 유사하나 커피빈만의 분위기가 있음 조용하고 직원의 나이스함에 휴식공간 느낌,5.0,6,3.0,0
커피빈 을지로입구역점,스타벅스 건너편에 있음 커피빈의자가 스벅보다 편함층 넓음 흡연부스 ,4.0,"1,327",3.0,0
사주카페샤프,내년 신년운세 보러 고고 사주외 뽑기도 하니 재밌었어요,4.0,30,5.0,0
사주카페샤프,여친이랑 해외일로바빠 추억삼아 보기 좋았다 ㅡ필요한말 들었슴,4.0,22,5.0,0
사주카페샤프,따뜻하고 조용해서 편하네요 좋은거나쁜거 걸러듣기로햇요,4.0,59,4.9,0
사주카페샤프,년말년시 맘의평화를위해 옴,4.0,64,4.9,0
사주카페샤프,회사직원들끼리 좋은 추억거리로 재밌었어요,4.0,72,4.9,0
사주카페샤프,신년운세너무 잘봣슴니다  조심할거 들으니 좀 신경이쓰이지만 그래도 필요하네요,4.0,52,4.8,0
사주카페샤프,연인과 같이 보기에 내가모르는 나도 있엇다 으 헝 나름,3.0,44,4.9,1
사주카페샤프,년도 내팔자가 궁금하다 제발 대박나기를 바라면서 ㅋㅋㅋ,4.0,59,4.9,0
사주카페샤프,가족들과 관계문제로 방문했는데 사이가 좋아지고 있네요 다 맞진 않지만 괜찮았어요,4.0,25,4.9,0
사주카페샤프,연말이라 마무리할겸 방문했는데 참고하기 좋았어요 ㅎㅎ,4.0,35,5.0,0
사주카페샤프,명동 놀러올때마다 한번씩 들려요ㅎ 오랜만에 왔지만 진정성 있는 사주맛집 늘 감사합니다,4.0,40,5.0,0
사주카페샤프,여기 좋아용 재미있고 즐겁게 상담받을 수 있었고 여러가지로 조언도 많이 받을 수 있었어용ㅎ,3.0,40,4.9,1
사주카페샤프,답답한 일이 있어 상담받았는데 가슴이 뻥 뚫리는 것 같습니다 여기저기 많이 다녀봤지만 여기가 최고인듯해요앞으로도 답답한 일들 생기면 찾아올게요 감사합니다,4.0,32,4.9,0
사주카페샤프,얼마전 다녀왔는데 정말 기가막히게 다 맞아서 깜짝 놀랐어요 앞으로 일어날 일들도 술술 잘 풀릴것만 같아요ㅎㅎ 그때 해주신 말씀들 가슴 깊이 새겨놓겠습니다 감사드려요,4.0,43,4.9,0
사주카페샤프,편안하게 대해주셔서 좋았어요,3.0,30,4.9,1
사주카페샤프,잘보셔서 속앓이하고 있던 궁금증들 다 해소 하고 왔어요 스트레스 제대로 풀렸습니당,4.0,35,5.0,0
사주카페샤프,요새 힘들어서 유명하다고 친구소개로 갔어요 자신을알고 때를 알게되는 시간이었어서 유익하고 재밌었어요,4.0,36,4.9,0
사주카페샤프,예약하고 갓슴 술마시고 오면 틀릴수있고 타로도 틀릴수있다 함 ㅡ그래서 사주랑이름점봄 ㅋㅋ,4.0,24,1.9,0
사주카페샤프,평일엔 직장다니느라 주말에 왔어요 혼자 계속 고민하던게 있었는데 시원이 속 풀린 느낌이예용,4.0,30,5.0,0
사주카페샤프,인간관계 이런거 취미를 말씀주셨는데 우리 모두 소름끼친다고 함진짜 어찌 척척아는지 신기할 따름다행스럽게 우리 모두 궁합이 좋다고 하셨음 ㅎㅎ 담에 또 올게요,5.0,20,5.0,0
사주카페샤프,친구랑 타로보러 왔다가 사주까지 보고왔는데 진솔하게 상담해주시고 다양한 조언도 해주시구 무엇보다 넘 재미있었어요ㅎㅎ,5.0,2,5.0,0
사주카페샤프,오래 알고지낸 지인처럼 아주 편안하게 상담하면서 마음이 무척 편안해졌습니다지인들에게 많이 추천하겠습니다,4.0,2,4.5,0
사주카페샤프,오엄청 자세하고 디테일하게 봐주셨어요전에 심란한 맘에 길거리에서 봤을땐 완전 별로였거든요ㅠ 앞으로 고민거리 생기면 여기로 올거에용,5.0,7,5.0,0
사주카페샤프,여자친구랑 두번째 방문이에요요즘 개인적으로 고민거리가 많았는데 말씀 듣고고민이 많이 해결된거같습니다갈때마다 느끼는거지만 사장님이 친절하게 잘 설명해주시면서도 중요한 주제들을 콕 집어 상담해주시니 심적으로 더 와닿더라구요반기마다 한번씩은 꼭 들르는거같아요사장님 건강하세요 ,5.0,1,5.0,0
사주카페샤프,여기 소개로 왔는데  오홋 신뢰  싱기궁합이랑타로도 봐주시고 내 칭군 이름까지 무료 감정   강 추,5.0,11,2.3,0
사주카페샤프,예약하고 왔고 친구들과 해외서 한번씩올때 들려 재미난 화제가되어 좋았다,4.0,1,4.0,0
사주카페샤프,인간관계 잘 들었슴니다 가족처럼 얘기한거같았네요,4.0,1,4.0,0
사주카페샤프,굿 쪼아욧재밌군요,4.0,6,4.8,0
사주카페샤프,꿈과목표에 대한 내용을 듣고 좀더 깨닫게됬어요 좋은길잡이가됫어요,4.0,1,4.0,0
사주카페샤프,갑자기  보러갓다가 좋고 나쁜점 듣고 고쳐야겟다 생각하게 됬어요 물론 다맞진 않지만 그럭저럭 난 좋구먼유,4.0,117,5.0,0
사주카페샤프,지인소개와 소문듣고 예약하고 와봤습니다 답답했었는데 고민이 풀리는 시간이었어요  ,5.0,36,5.0,0
사주카페샤프,너무 흥미진진하게 말씀해주셔서 참 인생을 알아왔담니다ㅋㅎㅎ,4.0,1,4.0,0
사주카페샤프,안믿으려해도 유사하게 말함 오래된곳이네요향굿 재밋씀ㅡ운나쁠땐 몰해도 뒤집힌다함 ㅡ ㅡ기분이좋으신지 이말저말해주심 ,5.0,2,5.0,0
사주카페샤프,요사이 혼자 고민햇던게 그나마 도움되 마음의안정이 생겨 감사하네요,4.0,2,4.5,0
사주카페샤프,사람없을때 가니까 말씀도 조곤조곤해주심 년생 재미로 보러왓는데의외로 특이점얘기해주심 현실을,4.0,39,4.9,0
사주카페샤프,형제같이와서 적잖이 조언 잘듣고 감기존 사주가 아니고 다른걸 많이말씀줌,4.0,41,5.0,0
사주카페샤프,별점보고 오길잘함  다른점들도 난 만족하는구만 매우 친절하심,5.0,46,5.0,0
사주카페샤프,인생의 사이클을 잘말씀하셔서 깜짝놀랫네요 재방문의사,5.0,35,5.0,0
사주카페샤프,이름사주같이봄  타로도봄 단짝친구랑 와봄신기하고 즐거운 시간됨 ㅎㅎ,5.0,34,5.0,0
사주카페샤프,지인소개로 와서 즐겁게 보고 갔담니다,4.0,41,5.0,0
사주카페샤프,다 맞을순 없지만 개개인의 성향에 따라 받아 들이는게 다른거 같다 보니 나랑은 잘맞는 곳이라 좋았네요,5.0,41,5.0,0
사주카페샤프,복합적 상담을 해주시고 궁합과 이름도 봐주셧네요 추천 받아 왓는데 잘보시네요 굿,4.0,31,5.0,0
사주카페샤프,코로나여도 꼼꼼하게 상담해주시고 무엇보다 제가 궁금한걸 딱 맞춰서 해주시는 모습에 답답한 마음이 싹 풀렸어요  감사합니다 다음에 또 올게요,5.0,97,4.9,0
사주카페샤프,이런말 감안하고 말한거아닌가요ㅋㅋ욕듣기는싫고 싸가지없ㄱ말하는거는 기억안하고 참돈독만오르고 인성이 덜됐네요 댓글조작하는거같은데 장사잘되시길 바랍니다뜨내기손님한테 바가지씌우지 마시고요,1.0,5,1.8,1
사주카페샤프,사주가 궁금해서 친구랑 가봤는데 친절하시고 상세히 봐주셔서 좋았네요 사주도 잘나와서 다행이었어요,5.0,5,5.0,0
사주카페샤프,지인이 추천해줘서 다녀왔어요 말을 잘 들어주시고 얘기해주시는 것도 잘 듣고왔네용,4.0,11,4.9,0
사주카페샤프,앞으로 어떻게 살아가야할지를 들었답니다맘상하는 내용도있지만 부족한거 들어서 그나마 위안되네요 힘들때 힐링이된시간 많이 감사하고 생각이나네요 감사합니다,5.0,6,5.0,0
사주카페샤프,사주보러 방문했습니다올해 제가 삼재라고 듣긴들었다보니더 신중히 사주를보았는데요 그렇게 심한 악삼재가 아니라고해서안심이되더라구요상냥하게 사주봐주셔서그런지 더 마음편안하게 보았습니다담번엔 남자친구하고 또 들려야겠어요,4.0,127,5.0,0
사주카페샤프,왠만하면 타로는 잘 믿지않는데 여기는 확실히 다르네요타로는 서양사주라고 들었는데 와소름싹다 맞추시더라구요올해내년까지 조심하라하셔서 조심하며 사람알아가야겠습니다ㅎㅎ,5.0,12,5.0,0
사주카페샤프,호캉스 왔다가 들렸슴  너무 막 믿지 말라고 신점보다 난 더 괜찮았다,5.0,71,5.0,0
사주카페샤프,운세 좋은날이라고 써있어서 길가다가 와봤슴 잘 봤다고 생각,4.0,2,4.5,0
사주카페샤프,요새 하도 어수선해서 잠시 들려 대화하니 나름 정리가 되고 신기한 말씀도 해주셧네요,5.0,3,5.0,0
사주카페샤프,다 맞다곤 볼수없지만 대략이지만 정성스리 봐주셔서   자식들보러왓는데 그나마 도움된듯,5.0,2,5.0,0
사주카페샤프,첨보러 와서 낯설었지만 나름 시간 가는줄 몰르고 듣게 되었네요 친절하게 설명 주셔서 그간의 맘 고생이 사라지게 됬다고나 할까감사하네요 ,5.0,1,5.0,0
사주카페샤프,후기 잘 안쓰지만 지인들 회사 사람들 소개로  명이 우르르 와서 모두 숨죽여 들었다 나름 괜찮은 힐링시간 ㅋㅋㅋㅋ 서로가 서로를 얘기할때 모두 박수치면서 마지막이 대박이긴 했던거 ,5.0,2,5.0,0
사주카페샤프,다 맞는다고 하지 않으셨던게 더 진솔했고 그나마 위로 받고 가는것에 감사 궁합보고 사주보길 잘했슴니다애들때메 많이 걱정 했었슴니다,5.0,203,5.0,0
사주카페샤프,줄이 대기 하고 있어서 계속 기다린 날이었다 막 대박은 아니지만 나름 정리할 수 있는 시간이라 참고가 많이 됐다고나 할까 마구 웃다가 왔다 나름 즐거운 시간 예약하고 올걸,5.0,3,5.0,0
사주카페샤프,친구랑 명동가서 놀다가 사주카페 잇길래 한번 보고싶어서 갔다온곳이에여 좋은 얘기 들어서 너무 좋고 힘났습니다 돈이 하나도 안아까울 정도였어요,5.0,134,4.9,0
사주카페샤프,전부터 제 사주가 궁금해서 괜찮은곳 찾다가 여기 오게 됬어요 나름 평균적이고 조용해서 괜춘,4.0,1,4.0,0
사주카페샤프,사주이름 무속 점은 믿거나 말거나지만 딱맞을땐 소오오오름 사주치료도 받았고 다 맞는건아니지만 변하고 기다려보라고 했으니까 ㅋ,4.0,1,4.0,0
사주카페샤프,솔직한 후기 상담도 인연이 있기에 그때마다 내용이 다르다고 했슴 상대와의 공감대가 중요해 컨디션 안좋을뗀 틀릴때도 있다고 하는게 더 진솔했슴선생님은 철학과 상담 주역을 연구하셔서 시간이 긴 상담보단 짧고 절도 있게 팩트만 알려주셔서 전 좋았어요쓸데 없이 종일 하는것 보단 난 이게 좋았다,5.0,18,4.9,0
사주카페샤프,지나다가 검색해서 답답한 마음에 찾게 되었지만분가량 선생님과 나눈 대화와 좋은 어드바이스로울쌍으로 갔다 기분좋게 나왔네요올해까지 삼재여서 힘들었을거라고 조언해주시고 내년부터는 운이 들어와서 조금씩 잘될거란 말에 힘을 얻고 갑니다몬있있슴 또 들어볼만하네요힘 되서 감사합니다,4.0,96,5.0,0
사주카페샤프,여기 저기 가서 많이 봣지만 그래도 몬가 속이 시원하군요 각자 다른 형태로 말씀주시만 뭔 그냥 안좋은말만 들었지만  그래도 많은데 가서 본것 보단 제겐 의미있는 곳이였어요회사 사람들이나 주변 평판이 좋아서 왔어요무당이나 점짐은 너무나 간단히 말해주고 만 만 내고  부적이나 굿도 하라고 해서 힘들었어요 ,5.0,52,5.0,0
사주카페샤프,앉자마자 뭐 물어보지도 않으시고 이것저것 얘기해주시는데 솔직히 속으로 좀 놀랐고 게다가 엄청 친절하시고 진심어린 조언도 많이 해주셔서 도움 많이 되었네요 감사드려요,5.0,79,5.0,0
사주카페샤프,정말 앞이 막막할 때 도움이 많이 됐어요 부드럽고 친절하게 잘 봐주셔서 감사해요 ,5.0,13,5.0,0
사주카페샤프,삭제 당해서 다시 쓰는데요 더 자세히 쓰겠습니다 친구랑 두 명이서 같이 보러 갔는데 친구도 사주를 많이 보러 다니는 친구여서 다른 곳이랑 비교해서 말씀 드리자면요 제가 보기 전에 시작할 때 시간이랑 끝날때까지 시간 확인했는데요 한명당 분 해서 총 분 정도 봐주셨는데 가격은 다른 곳 보다 두배고요 설명도 다른 곳에 비해 두루뭉실하고 적어서 아쉬웠어요 본인 말이 틀릴 수도 있다고 그러고 그러면 사주 왜 보나요 마지막에 다른 곳들은 다 질문 시간이 있는데 질문할 거 있냐고 물어보지도 않고 그냥 끝 입금해 이러셔서 당황스러웠네요 질문 하려고 하니까 중요한 건 다 얘기했다고 금방 뒤에 잡힌 예약 때문에 내보내려고 하시더라고요 좋은 말만 들으시려고 지우시려는 거 같은데 비판의 말도 수긍할 줄 아셔야죠,2.0,1,2.0,1
사주카페샤프,사주외 이름점도 봐주시고 인연법도 알려주셨어요아주감사했슴니다이런맛에 보는가봐요 ,5.0,29,4.8,0
사주카페샤프,친구이랑 갓다 모두 너무재밌었어요 다들웃다가 나옴 하하하 친구추천함 우리도소개로오고 ,5.0,5,4.2,0
사주카페샤프,살면서 사주겸 점 같이 봤는데 말문이턱막힘 점보고 나갈땐 친구제복입으라고 딱말하심 헉  친구 경찰학과인디 정확하심,5.0,6,5.0,0
사주카페샤프,이곳저곳 꽤 가봤지만 잘 간것같아요 와이프랑 같이 갔는데 미래에 대한 마음이 조금 편하게 느껴진 하루였습니다ㅡ,5.0,7,4.3,0
사주카페샤프,좋은 말씀 나쁜 말씀 콕 찝어주셔서 맴아팠지만 참고할게요,5.0,45,5.0,0
사주카페샤프,역시 사주등  한곳 상장도봄 제운에 실망은 했지만 괜찮아요 노력하기로함,4.0,7,4.9,0
사주카페샤프,여기 용하네  너무 재밌었어요 맞아요를 몆번이나 하면서 친구랑 가서 웃다가 왔어요  사람마다 도착운이 달라서 우울한 말도 한다고했음 개웃김 틀릴때도 있다고 한게 더웃김,5.0,4,4.5,0
사주카페샤프,선생님께서 저보고 나물이라고 하셧어요 꽃이거나 남잔데 어머님이 제 태몽이 도라지 꿈 꾸셨다고 ㅋㅋ 이런게 어떻게 맞지요 신기하군요 열심히 살라고 하시네요 ㅋ,4.0,6,4.3,0
사주카페샤프,운세는 예측하는거지 노력하고 기다리는거지  아니시라고 하신말씀이 생각납니다,4.0,7,4.6,0
사주카페샤프,아 한명 친구는 잘된다고 했는데 그리됐고 한명은 말씀처럼 됐어욥 여유있게 시간내서 한번 보러갈께용 연말연시 바쁘시다셔서용 백신패스 ,5.0,5,4.4,0
사주카페샤프,어제본사람입니다  공대출신인데 너무 재밌게 말씀해주셔서 참고 많이 됐습니다 또 들릴께요,5.0,5,4.2,0
사주카페샤프,리뷰  나를 돌아보는 시간이였다못나고 못된 나를 선생님 감사해요 ㅠㅠ 흑흑 또올께요 ㅎ,4.0,4,4.8,0
사주카페샤프,리뷰 잘 안쓰는데 부장님과 같이 회사 근처에서 잠깐 재미로 보러 왔는데 깜짝 놀라고 재밌어 하시더라구요  까지 ㅋㅋ 차분하게 잘 들었네요,4.0,5,4.4,0
사주카페샤프,오늘 친구랑 와서 봤는데 나오면서도 깜짝놀랐어용 가격은 만원으로 봤어요 우린 년생임,5.0,39,4.9,0
